{
  "recordId": "bm_12345678",
  "benchmark": "pcr-smoke",
  "scenarioId": "constraint-50-turns",
  "seed": 42,
  "variant": "deterministic-mvp",
  "piVersion": "0.84.3",
  "nodeVersion": "22.23.2",
  "taskSuccess": true,
  "quality": {
    "constraintRecall": 1.0
  },
  "cost": {
    "inputTokens": 80000,
    "cacheReadTokens": 50000
  },
  "latency": {
    "p95Ms": 45
  },
  "memory": {
    "activeTokens": 18000
  },
  "artifactsHash": "eeeeeeeeeeeeeeeeeeeeeeeeeeeeeeeeeeeeeeeeeeeeeeeeeeeeeeeeeeeeeeee"
}
